ID;name;description;price
29cc3dcd-ab21-4ea2-bbd4-f1ea4530bed2;Laptop;High-performance laptop for gaming and work;999.99
157a3f6a-273c-4c2c-9eb5-6f43896a7b8e;Smartphone;Latest model smartphone with advanced features;799.99
b469f83c-e5e3-4831-aa47-eb75b87d7793;Headphones;Noise-cancelling headphones for immersive sound;199.99
c1cbefd3-61db-4ae2-9593-8f68f0a0e52d;Smartwatch;Stylish smartwatch with fitness tracking;299.99
64376861-a119-46cb-89fc-35a2091c8983;Tablet;Portable tablet for work and entertainment;499.99